{
  "event_id": "11111111-1111-1111-1111-111111111111",
  "run_id": "22222222-2222-2222-2222-222222222222",
  "timestamp": "2026-10-02T16:03:00Z",
  "type": "ToolStarted",
  "data": {
    "tool_name": "file_writer",
    "capability": "project.write",
    "action_id": "33333333-3333-3333-3333-333333333333"
  }
}
